<?xml version="1.0"?>
<!DOCTYPE xmitransformations SYSTEM 'xmitrans.dtd'>

<xmitransformations version="2.0">

<xmitransformation modelelement="sdmetricsbase" xmipattern="sdmetricsbase" recurse="true">
<trigger name="id" type="attrval" attr="xmi:id" />
<trigger name="name" type="attrval" attr="name" />
</xmitransformation>

<xmitransformation modelelement="interaction" xmipattern="uml:Interaction" recurse="true">
	<trigger name="lifelines" type="xmi2assoc" src="uml:Lifeline" attr="lifeline" />
	<trigger name="messages" type="xmi2assoc" src="uml:Message" attr="message" />
	<trigger name="fragments" type="xmi2assoc" attr="fragment" />
</xmitransformation>

<xmitransformation modelelement="lifeline" xmipattern="uml:Lifeline">
	<trigger name="coveredBy" type="xmi2assoc" attr="coveredBy" />
	<trigger name="represents" type="xmi2assoc" attr="represents" />
</xmitransformation>

<xmitransformation modelelement="occurrencespec" xmipattern="uml:MessageOccurrenceSpecification">
	<trigger name="covered" type="xmi2assoc" attr="covered" />
	<trigger name="event" type="xmi2assoc" attr="event" />
</xmitransformation>

<xmitransformation modelelement="package" xmipattern="uml:Package" recurse="true" />
<xmitransformation modelelement="model" xmipattern="uml:Model" recurse="true" />

</xmitransformations>
