<?xml version="1.0"?>
<!DOCTYPE xmitransformations SYSTEM 'xmitrans.dtd'>

<xmitransformations version="2.0">

<xmitransformation modelelement="sdmetricsbase" xmipattern="sdmetricsbase" recurse="true">
<trigger name="id" type="attrval" attr="xmi.id" />
<trigger name="name" type="attrval" attr="name" />
<trigger name="context" type="attrval" attr="namespace"/>
<trigger name="stapplication" type="reflist" attr="xmi.idref" src="UML:ModelElement.stereotype" />
</xmitransformation>

<xmitransformation modelelement="class" xmipattern="UML:Class" recurse="true" />

<xmitransformation modelelement="stereotype" xmipattern="UML:Stereotype" />

</xmitransformations>
