<?xml version="1.0"?>
<!DOCTYPE xmitransformations SYSTEM 'xmitrans.dtd'>

<xmitransformations version="2.0">

<xmitransformation modelelement="sdmetricsbase" xmipattern="sdmetricsbase" recurse="true">
<trigger name="id" type="attrval" attr="xmi:id" />
<trigger name="name" type="attrval" attr="name" />
</xmitransformation>

<xmitransformation modelelement="model" xmipattern="uml:Model" recurse="true" />
<xmitransformation modelelement="package" xmipattern="uml:Package" recurse="true" />

<xmitransformation modelelement="eaextensionelement" xmipattern="element" requirexmiid="false" allowxmiidref="true" recurse="false" condition="geometry=''">
	<trigger name="elemref" type="attrval" attr="xmi:idref" />
	<trigger name="name" type="attrval" attr="name" />
	<trigger name="documentation" type="cattrval" attr="documentation" src="properties" />
	<trigger name="author" type="cattrval" attr="author" src="project" />
</xmitransformation>

</xmitransformations>
